{
  "$schema": "https://json-schema.org/draft/2020-12/schema",
  "title": "Log Source",
  "type": "object",
  "required": ["id", "path", "parser"],
  "properties": {
    "id": { "type": "string", "minLength": 1 },
    "path": { "type": "string", "minLength": 1 },
    "parser": {
      "type": "object",
      "required": ["type", "patterns"],
      "properties": {
        "type": { "const": "regex" },
        "patterns": {
          "type": "object",
          "minProperties": 1,
          "additionalProperties": { "type": "string" }
        }
      }
    },
    "classify": {
      "type": "array",
      "items": {
        "type": "object",
        "required": ["match", "event_type", "severity", "is_security_relevant"],
        "properties": {
          "match":                 { "type": "string", "minLength": 1 },
          "service":               { "type": "string" },
          "event_type":            { "type": "string", "minLength": 1 },
          "severity":              { "type": "string", "enum": ["low", "medium", "high"] },
          "is_security_relevant":  { "type": "boolean" },
          "extract": {
            "type": "object",
            "additionalProperties": { "type": "string" }
          }
        }
      }
    }
  }
}
